<?xml version="1.0" encoding="UTF-8"?>
<xs:schema xmlns:xs="http://www.w3.org/2001/XMLSchema">
    <xs:element name="schools">
        <xs:complexType>
            <xs:sequence>
                <xs:element name="school" maxOccurs="unbounded">
                    <xs:complexType>
                        <xs:sequence>
                            <xs:element name="rollno" type="xs:string" />
                            <xs:element name="name" type="xs:string" />
                            <xs:element name="branch" type="xs:string" />
                            <xs:element name="credits" type="xs:integer" />
                        </xs:sequence>
                    </xs:complexType>
                </xs:element>
            </xs:sequence>
        </xs:complexType>
    </xs:element>
</xs:schema>